{
  "query": "Rule 014",
  "timestamp": "2025-09-16T07:30:18.500328Z",
  "model": "qwen2.5:0.5b",
  "metadata": {
    "total_tracker_hits": 0,
    "total_rulebook_hits": 1,
    "rule_id": "014",
    "confidence": "high",
    "is_exact_rule": true,
    "about_rule": true,
    "context_text_length": 5537
  },
  "parsed_data": {
    "tracker_records": [],
    "rulebook_records": [
      {
        "document_id": "direct_file_014",
        "relevance_score": 1.0,
        "metadata": {
          "source": "direct_file_rule_014",
          "doctype": "complete_rulebook",
          "primary_rule_id": "014",
          "is_direct_read": true,
          "total_content_length": 5333
        },
        "content_type": "complete_rulebook",
        "rule_info": {
          "primary_rule_id": "014",
          "total_rows": 0,
          "is_complete": false,
          "is_direct_read": true
        },
        "procedure_steps": [
          {
            "row_index": 1,
            "data": {
              "sr.no.": 1.0,
              "inputs required": "Rule#014-User Assigned Privileged Role",
              "input details": null,
              "instructions": "A user has been assigned a privileged role, which may indicate unauthorized privilege escalation or administrative misuse.",
              "reviewer comments": null
            }
          },
          {
            "row_index": 2,
            "data": {
              "sr.no.": 2.0,
              "inputs required": "Incident Number",
              "input details": "208309",
              "instructions": null,
              "reviewer comments": null
            }
          },
          {
            "row_index": 3,
            "data": {
              "sr.no.": 3.0,
              "inputs required": "How many users are impacted ?",
              "input details": "1",
              "instructions": "Gather details of all users - (By adding sheet to this excel)",
              "reviewer comments": null
            }
          },
          {
            "row_index": 4,
            "data": {
              "sr.no.": 4.0,
              "inputs required": "Check Alert Details",
              "input details": "Yes",
              "instructions": "Username, Role Assigned, Time of Assignment, Initiator, Source IP, Location",
              "reviewer comments": "Check Ip prevalence & Repuation"
            }
          },
          {
            "row_index": 5,
            "data": {
              "sr.no.": 5.0,
              "inputs required": "Verify Role Sensitivity",
              "input details": "Yes",
              "instructions": "Determine if the assigned role is high-risk (e.g., Global Admin)",
              "reviewer comments": null
            }
          },
          {
            "row_index": 6,
            "data": {
              "sr.no.": 6.0,
              "inputs required": "Review Sign-In Logs",
              "input details": "Yes",
              "instructions": "Look for unusual sign-in patterns by the assigned user for last 7 days",
              "reviewer comments": null
            }
          },
          {
            "row_index": 7,
            "data": {
              "sr.no.": 7.0,
              "inputs required": "Check Activity of Initiator",
              "input details": "Observed the Events and checked user(Adminchintala) was accessed into MS-PIM, nothing Suspicious activities found, closing as FP.",
              "instructions": "Validate if the assigning user had legitimate access and permissions",
              "reviewer comments": "Check the Historical data of initiator  & alerts on initiator"
            }
          },
          {
            "row_index": 8,
            "data": {
              "sr.no.": 8.0,
              "inputs required": "Escalate if Unauthorized",
              "input details": "Not Required",
              "instructions": "if suspicious, escalate to L3/IT for investigation",
              "reviewer comments": "If  initiator  found compromise then Escalte to L3"
            }
          },
          {
            "row_index": 9,
            "data": {
              "sr.no.": 9.0,
              "inputs required": "if True Positive - Inform to IT Team to Reset the account, Revoke the MFA tokens, Temporary disable the account",
              "input details": null,
              "instructions": "Reach out to the Network/EDR teams to block the detected suspicious IP, Inform user to reset password, maintain complex password and enable MFA.",
              "reviewer comments": "Also Reset the all actvie user sessions  & Need to perform user precompromise & post compromise  actvity"
            }
          },
          {
            "row_index": 10,
            "data": {
              "sr.no.": 10.0,
              "inputs required": "Track for the closer/closer confirmation",
              "input details": "Closed",
              "instructions": "After all the investigation document the steps taken, findings, and any remediation actions required",
              "reviewer comments": null
            }
          },
          {
            "row_index": 11,
            "data": {
              "sr.no.": null,
              "inputs required": "True Positive (TP) Scenarios",
              "input details": "These indicate malicious or unauthorized role assignments:\nAttacker assigns themselves or another compromised account to a privileged role (e.g., Global Admin).\nPrivileged role assigned outside business hours from an unusual IP or geolocation.\nRole assignment follows a successful risky sign-in (e.g., impossible travel or TOR exit node).\nAssignment made by an unknown or suspicious app/service principal.\nMultiple privileged roles assigned in quick succession—suggesting lateral movement.\nAssignment to a dormant or deactivated account suddenly re-enabled.",
              "instructions": null,
              "reviewer comments": null
            }
          },
          {
            "row_index": 12,
            "data": {
              "sr.no.": null,
              "inputs required": "Benign Positive (BP) Scenarios",
              "input details": "These are unusual but legitimate actions:\nPrivileged role assigned temporarily via PIM (Privileged Identity Management) for a valid task.\nSecurity team grants temporary access for an urgent incident response.\nAdmin assigns a role to a new hire during onboarding, but outside normal hours.\nRole assignment from a new IP due to remote work or travel.",
              "instructions": null,
              "reviewer comments": null
            }
          },
          {
            "row_index": 13,
            "data": {
              "sr.no.": null,
              "inputs required": "False Positive (FP) Scenarios",
              "input details": "These are normal operations that trigger alerts unnecessarily:\nAdmin assigns a role to a user as part of routine access management.\nAssignment from a known corporate IP or trusted device, but not yet whitelisted.\nBulk role assignments during a migration or reorganization.\nTemporary elevation via PIM that’s not filtered out in the rule logic.",
              "instructions": null,
              "reviewer comments": null
            }
          }
        ],
        "content_length": 5333,
        "raw_content": "COMPLETE RULEBOOK: Rule#014-July-01-25 ( 208309 )(Sheet1).csv\n============================================================\nPRIMARY RULE: 014\nColumns: sr.no., inputs required, input details, instructions, reviewer comments\nTotal Rows: 13\n\nRow 1:\n{\n  \"row_index\": 1,\n  \"data\": {\n    \"sr.no.\": 1.0,\n    \"inputs required\": \"Rule#014-User Assigned Privileged Role\",\n    \"input details\": null,\n    \"instructions\": \"A user has been assigned a privileged role, which may indicate unauthorized privilege escalation or administrative misuse.\",\n    \"reviewer comments\": null\n  }\n}\n\nRow 2:\n{\n  \"row_index\": 2,\n  \"data\": {\n    \"sr.no.\": 2.0,\n    \"inputs required\": \"Incident Number\",\n    \"input details\": \"208309\",\n    \"instructions\": null,\n    \"reviewer comments\": null\n  }\n}\n\nRow 3:\n{\n  \"row_index\": 3,\n  \"data\": {\n    \"sr.no.\": 3.0,\n    \"inputs required\": \"How many users are impacted ?\",\n    \"input details\": \"1\",\n    \"instructions\": \"Gather details of all users - (By adding sheet to this excel)\",\n    \"reviewer comments\": null\n  }\n}\n\nRow 4:\n{\n  \"row_index\": 4,\n  \"data\": {\n    \"sr.no.\": 4.0,\n    \"inputs required\": \"Check Alert Details\",\n    \"input details\": \"Yes\",\n    \"instructions\": \"Username, Role Assigned, Time of Assignment, Initiator, Source IP, Location\",\n    \"reviewer comments\": \"Check Ip prevalence & Repuation\"\n  }\n}\n\nRow 5:\n{\n  \"row_index\": 5,\n  \"data\": {\n    \"sr.no.\": 5.0,\n    \"inputs required\": \"Verify Role Sensitivity\",\n    \"input details\": \"Yes\",\n    \"instructions\": \"Determine if the assigned role is high-risk (e.g., Global Admin)\",\n    \"reviewer comments\": null\n  }\n}\n\nRow 6:\n{\n  \"row_index\": 6,\n  \"data\": {\n    \"sr.no.\": 6.0,\n    \"inputs required\": \"Review Sign-In Logs\",\n    \"input details\": \"Yes\",\n    \"instructions\": \"Look for unusual sign-in patterns by the assigned user for last 7 days\",\n    \"reviewer comments\": null\n  }\n}\n\nRow 7:\n{\n  \"row_index\": 7,\n  \"data\": {\n    \"sr.no.\": 7.0,\n    \"inputs required\": \"Check Activity of Initiator\",\n    \"input details\": \"Observed the Events and checked user(Adminchintala) was accessed into MS-PIM, nothing Suspicious activities found, closing as FP.\",\n    \"instructions\": \"Validate if the assigning user had legitimate access and permissions\",\n    \"reviewer comments\": \"Check the Historical data of initiator  & alerts on initiator\"\n  }\n}\n\nRow 8:\n{\n  \"row_index\": 8,\n  \"data\": {\n    \"sr.no.\": 8.0,\n    \"inputs required\": \"Escalate if Unauthorized\",\n    \"input details\": \"Not Required\",\n    \"instructions\": \"if suspicious, escalate to L3/IT for investigation\",\n    \"reviewer comments\": \"If  initiator  found compromise then Escalte to L3\"\n  }\n}\n\nRow 9:\n{\n  \"row_index\": 9,\n  \"data\": {\n    \"sr.no.\": 9.0,\n    \"inputs required\": \"if True Positive - Inform to IT Team to Reset the account, Revoke the MFA tokens, Temporary disable the account\",\n    \"input details\": null,\n    \"instructions\": \"Reach out to the Network/EDR teams to block the detected suspicious IP, Inform user to reset password, maintain complex password and enable MFA.\",\n    \"reviewer comments\": \"Also Reset the all actvie user sessions  & Need to perform user precompromise & post compromise  actvity\"\n  }\n}\n\nRow 10:\n{\n  \"row_index\": 10,\n  \"data\": {\n    \"sr.no.\": 10.0,\n    \"inputs required\": \"Track for the closer/closer confirmation\",\n    \"input details\": \"Closed\",\n    \"instructions\": \"After all the investigation document the steps taken, findings, and any remediation actions required\",\n    \"reviewer comments\": null\n  }\n}\n\nRow 11:\n{\n  \"row_index\": 11,\n  \"data\": {\n    \"sr.no.\": null,\n    \"inputs required\": \"True Positive (TP) Scenarios\",\n    \"input details\": \"These indicate malicious or unauthorized role assignments:\\nAttacker assigns themselves or another compromised account to a privileged role (e.g., Global Admin).\\nPrivileged role assigned outside business hours from an unusual IP or geolocation.\\nRole assignment follows a successful risky sign-in (e.g., impossible travel or TOR exit node).\\nAssignment made by an unknown or suspicious app/service principal.\\nMultiple privileged roles assigned in quick succession—suggesting lateral movement.\\nAssignment to a dormant or deactivated account suddenly re-enabled.\",\n    \"instructions\": null,\n    \"reviewer comments\": null\n  }\n}\n\nRow 12:\n{\n  \"row_index\": 12,\n  \"data\": {\n    \"sr.no.\": null,\n    \"inputs required\": \"Benign Positive (BP) Scenarios\",\n    \"input details\": \"These are unusual but legitimate actions:\\nPrivileged role assigned temporarily via PIM (Privileged Identity Management) for a valid task.\\nSecurity team grants temporary access for an urgent incident response.\\nAdmin assigns a role to a new hire during onboarding, but outside normal hours.\\nRole assignment from a new IP due to remote work or travel.\",\n    \"instructions\": null,\n    \"reviewer comments\": null\n  }\n}\n\nRow 13:\n{\n  \"row_index\": 13,\n  \"data\": {\n    \"sr.no.\": null,\n    \"inputs required\": \"False Positive (FP) Scenarios\",\n    \"input details\": \"These are normal operations that trigger alerts unnecessarily:\\nAdmin assigns a...[TRUNCATED]"
      }
    ],
    "query_classification": {
      "about_rule": true,
      "about_tracker": false,
      "is_exact_rule": true,
      "rule_id": "014",
      "confidence": "high",
      "is_dynamic_match": true
    }
  },
  "statistics": {
    "tracker_stats": {
      "total_incidents": 0,
      "unique_rules": 0,
      "rules_found": [],
      "priorities": [],
      "statuses": [],
      "priority_distribution": {}
    },
    "rulebook_stats": {
      "total_documents": 1,
      "content_types": [
        "complete_rulebook"
      ],
      "total_procedure_steps": 13,
      "complete_rulebooks": 0,
      "direct_file_reads": 1
    },
    "overall_stats": {
      "total_documents": 1,
      "query_classification": {
        "about_rule": true,
        "about_tracker": false,
        "is_exact_rule": true,
        "rule_id": "014",
        "confidence": "high",
        "is_dynamic_match": true
      },
      "processing_successful": true
    }
  }
}